{
  "video_id": "test123",
  "video_url": "https://youtube.com/watch?v=test123",
  "video_title": "The Future of AI and Machine Learning",
  "channel_name": "TechTalks",
  "channel_id": "test_channel",
  "duration": 2730,
  "thumbnail_url": "https://img.youtube.com/vi/test123/maxresdefault.jpg",
  "summary": "## Video Context\n\n**Title**: The Future of AI and Machine Learning\n\n**Speakers**: Dr. Jane Smith, Prof. John Doe\n\n**Duration**: 45:30\n\n**Channel**: TechTalks\n\n**Synopsis**: A comprehensive discussion about the current state and future prospects of artificial intelligence and machine learning technologies.\n\n## 00:00 Rapid TL;DR (\u2264100 words)\n\nThis video explores cutting-edge AI developments, discussing how machine learning models are becoming increasingly sophisticated. The speakers highlight key breakthroughs in natural language processing, computer vision, and reinforcement learning. They address ethical considerations, potential societal impacts, and the importance of responsible AI development. The conversation covers practical applications across industries, from healthcare to finance, and predicts significant advances in AI capabilities over the next decade while emphasizing the need for proper governance and human oversight.\n\n## Key Moments (Timestamp \u2192 Insight)\n\n\u2013 **03:21** Introduction to transformer architectures revolutionizing NLP\n\u2013 **07:45** Discussion on GPT models and their capabilities\n\u2013 **12:30** Ethical considerations in AI deployment\n\u2013 **18:15** Real-world applications in healthcare diagnostics\n\u2013 **23:50** Future predictions for AGI development\n\u2013 **28:40** Importance of AI safety and alignment research\n\u2013 **35:20** Q&A session addressing common misconceptions\n\u2013 **42:10** Closing thoughts on responsible AI development\n\n## Key Concepts & Insights\n\n### Transformer Architecture Revolution\nThe speakers explain how transformer models have fundamentally changed the landscape of natural language processing. These models use self-attention mechanisms to process sequences more efficiently than previous architectures.\n\n### Ethical AI Framework\nA significant portion discusses the need for comprehensive ethical frameworks in AI development. This includes bias mitigation, transparency, and accountability measures.\n\n### Healthcare Applications\nSeveral concrete examples demonstrate AI's transformative potential in medical diagnostics, drug discovery, and personalized treatment plans.\n\n## Data, Tools & Resources\n\n**Tools Mentioned:**\n\u2022 TensorFlow and PyTorch for model development\n\u2022 Hugging Face Transformers library\n\u2022 OpenAI API for GPT integration\n\u2022 Weights & Biases for experiment tracking\n\n**Key Resources:**\n\u2022 \"Attention Is All You Need\" paper\n\u2022 AI Safety research from Anthropic\n\u2022 Stanford CS224N course materials\n\u2022 DeepMind's AlphaFold documentation\n\n## Summary & Calls-to-Action\n\nThe discussion emphasizes that while AI presents tremendous opportunities, responsible development requires collaboration between technologists, ethicists, and policymakers. Viewers are encouraged to stay informed about AI developments and participate in discussions about its societal impact.\n\n### Insight Enrichment\n\nEach key insight connects to broader themes in AI development, from technical innovations to societal implications. The speakers provide balanced perspectives on both opportunities and challenges.\n\n### Knowledge Cards\n\nThe presentation includes visual aids explaining complex concepts like attention mechanisms, making technical content accessible to a broader audience.\n\n### Accelerated-Learning Pack\n\n\u2013 **TL;DR-100**: Comprehensive AI discussion covering technical advances, ethical considerations, and future predictions with emphasis on responsible development.\n\n\u2013 **Feynman Flashcards** (\u226410)\n  - Q: What is a transformer architecture? / A: A neural network design using self-attention to process sequences efficiently\n  - Q: Why is AI safety important? / A: To ensure AI systems remain beneficial and aligned with human values as they become more powerful\n  - Q: What is bias in AI? / A: Systematic errors in AI outputs that unfairly discriminate against certain groups\n\n\u2013 **Glossary** (\u226415 terms)\n  - Transformer: Neural network architecture using attention mechanisms\n  - GPT: Generative Pre-trained Transformer\n  - AGI: Artificial General Intelligence\n  - Alignment: Ensuring AI goals match human values\n  - Fine-tuning: Adapting pre-trained models for specific tasks\n\n\u2013 **Quick Quiz** (3 Q&A)\n  - Q: What makes transformers more efficient than RNNs? / A: Parallel processing through self-attention\n  - Q: Name three industries benefiting from AI / A: Healthcare, finance, and education\n  - Q: What is the main ethical concern with large language models? / A: Potential for generating biased or harmful content\n\n\u2013 **Novel-Idea Meter** (score each insight 1-5)\n  - Transformer architecture explanation: 3/5 (well-known but clearly explained)\n  - Healthcare AI applications: 4/5 (innovative use cases presented)\n  - AI safety considerations: 5/5 (forward-thinking perspectives)\n",
  "key_points": [
    "Introduction to transformer architectures revolutionizing NLP",
    "Discussion on GPT models and their capabilities",
    "Ethical considerations in AI deployment",
    "Real-world applications in healthcare diagnostics",
    "Future predictions for AGI development"
  ],
  "user_id": "test-user",
  "created_at": "2025-07-27 04:37:00.220916",
  "metadata": {
    "title": "The Future of AI and Machine Learning",
    "channel": "TechTalks",
    "duration": "45:30",
    "speakers": [
      "Dr. Jane Smith",
      "Prof. John Doe"
    ],
    "synopsis": "A comprehensive discussion about the current state and future prospects of artificial intelligence and machine learning technologies.",
    "tone": "informative"
  },
  "key_moments": [
    {
      "timestamp": "03:21",
      "insight": "Introduction to transformer architectures revolutionizing NLP"
    },
    {
      "timestamp": "07:45",
      "insight": "Discussion on GPT models and their capabilities"
    },
    {
      "timestamp": "12:30",
      "insight": "Ethical considerations in AI deployment"
    },
    {
      "timestamp": "18:15",
      "insight": "Real-world applications in healthcare diagnostics"
    },
    {
      "timestamp": "23:50",
      "insight": "Future predictions for AGI development"
    },
    {
      "timestamp": "28:40",
      "insight": "Importance of AI safety and alignment research"
    },
    {
      "timestamp": "35:20",
      "insight": "Q&A session addressing common misconceptions"
    },
    {
      "timestamp": "42:10",
      "insight": "Closing thoughts on responsible AI development"
    }
  ],
  "flashcards": [
    {
      "question": "What is a transformer architecture?",
      "answer": "A neural network design using self-attention to process sequences efficiently"
    },
    {
      "question": "Why is AI safety important?",
      "answer": "To ensure AI systems remain beneficial and aligned with human values as they become more powerful"
    },
    {
      "question": "What is bias in AI?",
      "answer": "Systematic errors in AI outputs that unfairly discriminate against certain groups"
    }
  ],
  "quiz_questions": [
    {
      "question": "What makes transformers more efficient than RNNs?",
      "answer": "Parallel processing through self-attention"
    },
    {
      "question": "Name three industries benefiting from AI",
      "answer": "Healthcare, finance, and education"
    },
    {
      "question": "What is the main ethical concern with large language models?",
      "answer": "Potential for generating biased or harmful content"
    }
  ]
}